{
  "boTyp": "LEISTUNGSKURVENDEFINITION",
  "versionStruktur": "1",
  "beginndatum": "1922-01-12T02:27:31.0Z",
  "endedatum": "1891-05-29T19:58:18.0Z",
  "version": "1938-07-07T21:51:05.0Z",
  "code": "CODE_0010",
  "notwendigkeit": "DEFINITIONEN_WERDEN_VERWENDET",
  "leistungskurven": [
    {
      "code": "CODE_0111",
      "aenderungszeitpunkt": "1920-11-12T07:51:42.0Z",
      "haeufigkeit": "JAEHRLICH",
      "uebermittelbarkeit": "ELEKTRONISCH",
      "schwellwert": {
        "obererSchwellwert": 15.5,
        "untererSchwellwert": 6.5,
        "konfigurationsprodukt": "KONF_1100"
      },
      "konfigurationsprodukt": "KONF_0001"
    }
  ]
}